{
  "code_state": {
    "artifacts": [],
    "base_commit": null,
    "branch": null,
    "dirty_paths": [],
    "limitations": [
      "Code state has not been inspected"
    ],
    "pr_links": [],
    "relevant_paths": [],
    "unpublished_work": []
  },
  "continuation": {
    "blockers": [],
    "completed": [],
    "next_actions": [],
    "open_questions": [],
    "status": "unknown"
  },
  "created_at": "2026-10-01T16:00:00Z",
  "decisions": [],
  "dependencies": [],
  "findings": [],
  "handoff_id": "h-legacy",
  "issue_reference": null,
  "predecessor_revision_ids": [],
  "project": {
    "git_common_dir": null,
    "id": "p-legacy",
    "label": "synthetic",
    "root": "/synthetic/old-project"
  },
  "provenance": {
    "agent": null,
    "context_completeness": "unknown",
    "session": null,
    "sources": [],
    "uncertainties": []
  },
  "revision_id": "r-legacy",
  "schema_version": 1,
  "scope": {
    "acceptance_criteria": [],
    "boundaries": [],
    "constraints": [],
    "goal": "Continue a synthetic task",
    "task": "Synthetic legacy handoff",
    "title": "Synthetic legacy handoff"
  },
  "verification": {
    "checks": [],
    "not_run": []
  }
}
